{
  "schema_version": "1.0",
  "case_id": "AP01-44",
  "purpose": "semantic_ground_truth_never_provider_input",
  "sender": {
    "value": "Fiktive Kontrollstelle West",
    "evidence": [
      {
        "page": 1,
        "quote": "Fiktive Kontrollstelle West"
      }
    ]
  },
  "document_date": {
    "value": "2026-10-27",
    "evidence": [
      {
        "page": 1,
        "quote": "Datum: 27.10.2026"
      }
    ]
  },
  "recipients": [
    {
      "name": {
        "value": "Musterwerk Linde GmbH",
        "evidence": [
          {
            "page": 1,
            "quote": "An: Musterwerk Linde GmbH"
          }
        ]
      },
      "address": {
        "value": "Testweg 12, 00001 Musterstadt",
        "evidence": [
          {
            "page": 1,
            "quote": "Anschrift: Testweg 12, 00001 Musterstadt"
          }
        ]
      },
      "identifiers": [
        {
          "type": "de_tax_id",
          "value": "00000000123",
          "jurisdiction": null,
          "authority": null,
          "other_type": null,
          "holder_role": "addressee",
          "evidence": [
            {
              "page": 1,
              "quote": "Steuer-ID des Adressaten: 00000000123"
            }
          ]
        }
      ]
    }
  ],
  "customer_candidates": [
    "SYN-CUSTOMER-REGA"
  ],
  "candidate_evidence": [
    {
      "customer": "SYN-CUSTOMER-REGA",
      "kind": "exact_identifier",
      "recipient_index": 0,
      "identifier_index": 0
    }
  ],
  "actions": [
    {
      "gold_action_id": "AP01-44-obligation-1",
      "title": "Bitte erlaeutern Sie die Buchung TEST-82.",
      "description": "Bitte erlaeutern Sie die Buchung TEST-82.",
      "evidence": [
        {
          "page": 1,
          "quote": "Bitte erlaeutern Sie die Buchung TEST-82."
        }
      ],
      "deadline": {
        "kind": "not_found",
        "date": null,
        "wording": null,
        "anchor": null,
        "evidence": []
      }
    }
  ]
}
