{
  "schema_version": "1.0",
  "case_id": "AP01-57",
  "purpose": "semantic_ground_truth_never_provider_input",
  "sender": {
    "value": "Fiktive Berufsgenossenschaft Testhandwerk",
    "evidence": [
      {
        "page": 1,
        "quote": "Fiktive Berufsgenossenschaft Testhandwerk"
      }
    ]
  },
  "document_date": {
    "value": "2026-10-27",
    "evidence": [
      {
        "page": 1,
        "quote": "Ausfertigung: 27.10.2026"
      }
    ]
  },
  "recipients": [
    {
      "name": {
        "value": "Flussbogen Manufaktur GmbH",
        "evidence": [
          {
            "page": 1,
            "quote": "Empfänger: Flussbogen Manufaktur GmbH"
          }
        ]
      },
      "address": {
        "value": "Weidenkai 18, 00041 Fiktivhafen",
        "evidence": [
          {
            "page": 1,
            "quote": "Zustellanschrift: Weidenkai 18, 00041 Fiktivhafen"
          }
        ]
      },
      "identifiers": [
        {
          "type": "de_vat_id",
          "value": "DE000000731",
          "jurisdiction": null,
          "authority": null,
          "other_type": null,
          "holder_role": "addressee",
          "evidence": [
            {
              "page": 1,
              "quote": "USt-IdNr. des Empfängers: DE000000731"
            }
          ]
        }
      ]
    }
  ],
  "customer_candidates": [
    "SYN-CUSTOMER-VA"
  ],
  "candidate_evidence": [
    {
      "customer": "SYN-CUSTOMER-VA",
      "kind": "exact_identifier",
      "recipient_index": 0,
      "identifier_index": 0
    }
  ],
  "actions": [
    {
      "gold_action_id": "AP01-57-obligation-1",
      "title": "Entgelt im Meldebogen berichtigen",
      "description": "Bitte berichtigen Sie das beitragspflichtige Entgelt im Feld E4 bis zum 13.11.2026.",
      "evidence": [
        {
          "page": 1,
          "quote": "Bitte berichtigen Sie das beitragspflichtige Entgelt im Feld E4 bis zum 13.11.2026."
        }
      ],
      "deadline": {
        "kind": "explicit_date",
        "date": "2026-11-13",
        "wording": "Bitte berichtigen Sie das beitragspflichtige Entgelt im Feld E4 bis zum 13.11.2026.",
        "anchor": null,
        "evidence": [
          {
            "page": 1,
            "quote": "Bitte berichtigen Sie das beitragspflichtige Entgelt im Feld E4 bis zum 13.11.2026."
          }
        ]
      }
    }
  ]
}
