{
  "schema_version": "1.0",
  "case_id": "AP01-47",
  "purpose": "semantic_ground_truth_never_provider_input",
  "sender": {
    "value": "Fiktive Kontrollstelle West",
    "evidence": [
      {
        "page": 1,
        "quote": "Fiktive Kontrollstelle West"
      }
    ]
  },
  "document_date": {
    "value": "2026-10-27",
    "evidence": [
      {
        "page": 1,
        "quote": "Datum: 27.10.2026"
      }
    ]
  },
  "recipients": [
    {
      "name": {
        "value": "Musterwerk Linde GmbH",
        "evidence": [
          {
            "page": 1,
            "quote": "An: Musterwerk Linde GmbH"
          }
        ]
      },
      "address": {
        "value": "Testweg 12, 00001 Musterstadt",
        "evidence": [
          {
            "page": 1,
            "quote": "Anschrift: Testweg 12, 00001 Musterstadt"
          }
        ]
      },
      "identifiers": []
    }
  ],
  "customer_candidates": [
    "SYN-CUSTOMER-REGA"
  ],
  "candidate_evidence": [
    {
      "customer": "SYN-CUSTOMER-REGA",
      "kind": "name_address",
      "recipient_index": 0,
      "identifier_index": null
    }
  ],
  "actions": [
    {
      "gold_action_id": "AP01-47-obligation-1",
      "title": "Bitte senden Sie die unterschriebene Vollmacht.",
      "description": "Bitte senden Sie die unterschriebene Vollmacht.",
      "evidence": [
        {
          "page": 1,
          "quote": "Bitte senden Sie die unterschriebene Vollmacht."
        }
      ],
      "deadline": {
        "kind": "not_found",
        "date": null,
        "wording": null,
        "anchor": null,
        "evidence": []
      }
    }
  ]
}
