{
  "schema_version": "1.0",
  "case_id": "AP01-71",
  "purpose": "semantic_ground_truth_never_provider_input",
  "sender": {
    "value": "Fiktives Kommunikationsnetz Heidebogen",
    "evidence": [
      {
        "page": 1,
        "quote": "Von: Fiktives Kommunikationsnetz Heidebogen"
      }
    ]
  },
  "document_date": {
    "value": "2026-10-27",
    "evidence": [
      {
        "page": 1,
        "quote": "Ausfertigung: 27.10.2026"
      }
    ]
  },
  "recipients": [
    {
      "name": {
        "value": "Silbermoos Medien UG",
        "evidence": [
          {
            "page": 1,
            "quote": "Empfänger: Silbermoos Medien UG"
          }
        ]
      },
      "address": {
        "value": "Pixelgasse 6, 00045 Beispielhain",
        "evidence": [
          {
            "page": 1,
            "quote": "Zustellanschrift: Pixelgasse 6, 00045 Beispielhain"
          }
        ]
      },
      "identifiers": [
        {
          "type": "de_vat_id",
          "value": "DE000000734",
          "jurisdiction": null,
          "authority": null,
          "other_type": null,
          "holder_role": "addressee",
          "evidence": [
            {
              "page": 1,
              "quote": "USt-IdNr. des Empfängers: DE000000734"
            }
          ]
        }
      ]
    }
  ],
  "customer_candidates": [
    "SYN-CUSTOMER-VF"
  ],
  "candidate_evidence": [
    {
      "customer": "SYN-CUSTOMER-VF",
      "kind": "exact_identifier",
      "recipient_index": 0,
      "identifier_index": 0
    }
  ],
  "actions": []
}
