{
  "schema_version": "1.0",
  "case_id": "AP01-36",
  "purpose": "semantic_ground_truth_never_provider_input",
  "sender": {
    "value": "Fiktive Prüfstelle Musterbezirk 20",
    "evidence": [
      {
        "page": 1,
        "quote": "Fiktive Prüfstelle Musterbezirk 20"
      }
    ]
  },
  "document_date": {
    "value": "2026-10-25",
    "evidence": [
      {
        "page": 1,
        "quote": "Datum: 25.10.2026"
      }
    ]
  },
  "recipients": [
    {
      "name": {
        "value": "Unbekanntes Musterunternehmen Delta KG",
        "evidence": [
          {
            "page": 1,
            "quote": "An: Unbekanntes Musterunternehmen Delta KG"
          }
        ]
      },
      "address": {
        "value": "Phantasiestraße 83, 00000 Testort",
        "evidence": [
          {
            "page": 1,
            "quote": "Anschrift: Phantasiestraße 83, 00000 Testort"
          }
        ]
      },
      "identifiers": []
    }
  ],
  "customer_candidates": [],
  "candidate_evidence": [],
  "actions": [
    {
      "gold_action_id": "AP01-36-obligation-1",
      "title": "Musterplan zurücksenden",
      "description": "Senden Sie den künstlichen Investitionsplan unterschrieben zurück.",
      "evidence": [
        {
          "page": 1,
          "quote": "Senden Sie den künstlichen Investitionsplan unterschrieben zurück."
        }
      ],
      "deadline": {
        "kind": "explicit_date",
        "date": "2026-12-09",
        "wording": "Spätester Eingang: 09.12.2026.",
        "anchor": null,
        "evidence": [
          {
            "page": 1,
            "quote": "Spätester Eingang: 09.12.2026."
          }
        ]
      }
    }
  ]
}
