{
  "schema_version": "1.0",
  "case_id": "AP01-46",
  "purpose": "semantic_ground_truth_never_provider_input",
  "sender": {
    "value": "Fiktive Kontrollstelle West",
    "evidence": [
      {
        "page": 1,
        "quote": "Fiktive Kontrollstelle West"
      }
    ]
  },
  "document_date": {
    "value": "2026-10-27",
    "evidence": [
      {
        "page": 1,
        "quote": "Datum: 27.10.2026"
      }
    ]
  },
  "recipients": [
    {
      "name": {
        "value": "Musterwerk Linde GmbH",
        "evidence": [
          {
            "page": 1,
            "quote": "An: Musterwerk Linde GmbH"
          }
        ]
      },
      "address": {
        "value": "Testweg 12, 00001 Musterstadt",
        "evidence": [
          {
            "page": 1,
            "quote": "Anschrift: Testweg 12, 00001 Musterstadt"
          }
        ]
      },
      "identifiers": [
        {
          "type": "other",
          "value": "REG-0042",
          "jurisdiction": "TEST-NORD",
          "authority": "Fiktive Registerstelle Nord",
          "other_type": "Aktenreferenz",
          "holder_role": "addressee",
          "evidence": [
            {
              "page": 1,
              "quote": "Referenz des Adressaten: REG-0042\nReferenztyp: Aktenreferenz\nAusstellende Stelle der Referenz: Fiktive Registerstelle Nord\nGeltungsbereich der Referenz: TEST-NORD"
            }
          ]
        }
      ]
    }
  ],
  "customer_candidates": [
    "SYN-CUSTOMER-REGA",
    "SYN-CUSTOMER-REGB"
  ],
  "candidate_evidence": [
    {
      "customer": "SYN-CUSTOMER-REGA",
      "kind": "exact_identifier",
      "recipient_index": 0,
      "identifier_index": 0
    },
    {
      "customer": "SYN-CUSTOMER-REGB",
      "kind": "exact_identifier",
      "recipient_index": 0,
      "identifier_index": 0
    }
  ],
  "actions": [
    {
      "gold_action_id": "AP01-46-obligation-1",
      "title": "Bitte bestaetigen Sie die Bankverbindung bis zum 18.11.2026.",
      "description": "Bitte bestaetigen Sie die Bankverbindung bis zum 18.11.2026.",
      "evidence": [
        {
          "page": 1,
          "quote": "Bitte bestaetigen Sie die Bankverbindung bis zum 18.11.2026."
        }
      ],
      "deadline": {
        "kind": "explicit_date",
        "date": "2026-11-18",
        "wording": "bis zum 18.11.2026",
        "anchor": null,
        "evidence": [
          {
            "page": 1,
            "quote": "bis zum 18.11.2026"
          }
        ]
      }
    }
  ]
}
