{
  "schema_version": "1.0",
  "case_id": "AP01-24",
  "purpose": "semantic_ground_truth_never_provider_input",
  "sender": {
    "value": "Fiktive Prüfstelle Musterbezirk 08",
    "evidence": [
      {
        "page": 1,
        "quote": "Fiktive Prüfstelle Musterbezirk 08"
      }
    ]
  },
  "document_date": {
    "value": "2026-10-25",
    "evidence": [
      {
        "page": 1,
        "quote": "Datum: 25.10.2026"
      }
    ]
  },
  "recipients": [
    {
      "name": {
        "value": "Beispielbetrieb Gamma GmbH",
        "evidence": [
          {
            "page": 1,
            "quote": "An: Beispielbetrieb Gamma GmbH"
          }
        ]
      },
      "address": {
        "value": "Musterweg 9, 00000 Beispielstadt",
        "evidence": [
          {
            "page": 1,
            "quote": "Anschrift: Musterweg 9, 00000 Beispielstadt"
          }
        ]
      },
      "identifiers": [
        {
          "type": "other",
          "value": "SYN-0009",
          "jurisdiction": "SYNTHETIC",
          "authority": "Fiktive Beispielstelle",
          "other_type": "synthetic_client_reference",
          "holder_role": "addressee",
          "evidence": [
            {
              "page": 1,
              "quote": "Mandantenreferenz: SYN-0009"
            }
          ]
        }
      ]
    }
  ],
  "customer_candidates": [
    "SYN-CUSTOMER-C"
  ],
  "candidate_evidence": [
    {
      "customer": "SYN-CUSTOMER-C",
      "kind": "exact_identifier",
      "recipient_index": 0,
      "identifier_index": 0
    }
  ],
  "actions": [
    {
      "gold_action_id": "AP01-24-obligation-1",
      "title": "Erklärung unterschreiben",
      "description": "Senden Sie die unterschriebene Mustererklärung zurück.",
      "evidence": [
        {
          "page": 1,
          "quote": "Senden Sie die unterschriebene Mustererklärung zurück."
        }
      ],
      "deadline": {
        "kind": "explicit_date",
        "date": "2026-12-21",
        "wording": "Spätester Eingang: 21.12.2026.",
        "anchor": null,
        "evidence": [
          {
            "page": 1,
            "quote": "Spätester Eingang: 21.12.2026."
          }
        ]
      }
    }
  ]
}
