{
  "schema_version": "1.0",
  "case_id": "AP01-64",
  "purpose": "semantic_ground_truth_never_provider_input",
  "sender": {
    "value": "Fiktive Förderbank Probefeld",
    "evidence": [
      {
        "page": 1,
        "quote": "Fiktive Förderbank Probefeld"
      }
    ]
  },
  "document_date": {
    "value": "2026-10-27",
    "evidence": [
      {
        "page": 1,
        "quote": "Ausfertigung: 27.10.2026"
      }
    ]
  },
  "recipients": [
    {
      "name": {
        "value": "Morgenfarn Labor GmbH",
        "evidence": [
          {
            "page": 1,
            "quote": "Empfänger: Morgenfarn Labor GmbH"
          }
        ]
      },
      "address": {
        "value": "Kristallallee 3, 00042 Probedorf",
        "evidence": [
          {
            "page": 1,
            "quote": "Zustellanschrift: Kristallallee 3, 00042 Probedorf"
          }
        ]
      },
      "identifiers": [
        {
          "type": "de_vat_id",
          "value": "DE000000732",
          "jurisdiction": null,
          "authority": null,
          "other_type": null,
          "holder_role": "addressee",
          "evidence": [
            {
              "page": 1,
              "quote": "USt-IdNr. des Empfängers: DE000000732"
            }
          ]
        }
      ]
    }
  ],
  "customer_candidates": [
    "SYN-CUSTOMER-VB"
  ],
  "candidate_evidence": [
    {
      "customer": "SYN-CUSTOMER-VB",
      "kind": "exact_identifier",
      "recipient_index": 0,
      "identifier_index": 0
    }
  ],
  "actions": [
    {
      "gold_action_id": "AP01-64-obligation-1",
      "title": "Ausgabenübersicht einreichen",
      "description": "Reichen Sie die unterschriebene Ausgabenübersicht bis zum 24.11.2026 ein.",
      "evidence": [
        {
          "page": 1,
          "quote": "Reichen Sie die unterschriebene Ausgabenübersicht bis zum 24.11.2026 ein."
        }
      ],
      "deadline": {
        "kind": "explicit_date",
        "date": "2026-11-24",
        "wording": "Reichen Sie die unterschriebene Ausgabenübersicht bis zum 24.11.2026 ein.",
        "anchor": null,
        "evidence": [
          {
            "page": 1,
            "quote": "Reichen Sie die unterschriebene Ausgabenübersicht bis zum 24.11.2026 ein."
          }
        ]
      }
    },
    {
      "gold_action_id": "AP01-64-obligation-2",
      "title": "Eigenmittel nachweisen",
      "description": "Legen Sie den Nachweis der Eigenmittel bis zum 26.11.2026 vor.",
      "evidence": [
        {
          "page": 2,
          "quote": "Legen Sie den Nachweis der Eigenmittel bis zum 26.11.2026 vor."
        }
      ],
      "deadline": {
        "kind": "explicit_date",
        "date": "2026-11-26",
        "wording": "Legen Sie den Nachweis der Eigenmittel bis zum 26.11.2026 vor.",
        "anchor": null,
        "evidence": [
          {
            "page": 2,
            "quote": "Legen Sie den Nachweis der Eigenmittel bis zum 26.11.2026 vor."
          }
        ]
      }
    }
  ]
}
