{
  "schema_version": "1.0",
  "case_id": "AP01-65",
  "purpose": "semantic_ground_truth_never_provider_input",
  "sender": {
    "value": "Fiktive Sozialkasse Werkstätten",
    "evidence": [
      {
        "page": 1,
        "quote": "Fiktive Sozialkasse Werkstätten"
      }
    ]
  },
  "document_date": {
    "value": "2026-10-27",
    "evidence": [
      {
        "page": 1,
        "quote": "Ausfertigung: 27.10.2026"
      }
    ]
  },
  "recipients": [
    {
      "name": {
        "value": "Flussbogen Manufaktur GmbH",
        "evidence": [
          {
            "page": 1,
            "quote": "Empfänger: Flussbogen Manufaktur GmbH"
          }
        ]
      },
      "address": {
        "value": "Weidenkai 18, 00041 Fiktivhafen",
        "evidence": [
          {
            "page": 1,
            "quote": "Zustellanschrift: Weidenkai 18, 00041 Fiktivhafen"
          }
        ]
      },
      "identifiers": [
        {
          "type": "de_vat_id",
          "value": "DE000000731",
          "jurisdiction": null,
          "authority": null,
          "other_type": null,
          "holder_role": "addressee",
          "evidence": [
            {
              "page": 1,
              "quote": "USt-IdNr. des Empfängers: DE000000731"
            }
          ]
        }
      ]
    }
  ],
  "customer_candidates": [
    "SYN-CUSTOMER-VA"
  ],
  "candidate_evidence": [
    {
      "customer": "SYN-CUSTOMER-VA",
      "kind": "exact_identifier",
      "recipient_index": 0,
      "identifier_index": 0
    }
  ],
  "actions": [
    {
      "gold_action_id": "AP01-65-obligation-1",
      "title": "Urlaubskonten abgleichen",
      "description": "Bitte gleichen Sie die Urlaubskontostände bis zum 27.11.2026 mit Ihrer Lohnabrechnung ab.",
      "evidence": [
        {
          "page": 1,
          "quote": "Bitte gleichen Sie die Urlaubskontostände bis zum 27.11.2026 mit Ihrer Lohnabrechnung ab."
        }
      ],
      "deadline": {
        "kind": "explicit_date",
        "date": "2026-11-27",
        "wording": "Bitte gleichen Sie die Urlaubskontostände bis zum 27.11.2026 mit Ihrer Lohnabrechnung ab.",
        "anchor": null,
        "evidence": [
          {
            "page": 1,
            "quote": "Bitte gleichen Sie die Urlaubskontostände bis zum 27.11.2026 mit Ihrer Lohnabrechnung ab."
          }
        ]
      }
    },
    {
      "gold_action_id": "AP01-65-obligation-2",
      "title": "Beschäftigungszeiten berichtigen",
      "description": "Melden Sie abweichende Beschäftigungszeiten innerhalb von zehn Tagen nach Erhalt dieses Schreibens.",
      "evidence": [
        {
          "page": 1,
          "quote": "Melden Sie abweichende Beschäftigungszeiten innerhalb von zehn Tagen nach Erhalt dieses Schreibens."
        }
      ],
      "deadline": {
        "kind": "relative",
        "date": null,
        "wording": "Melden Sie abweichende Beschäftigungszeiten innerhalb von zehn Tagen nach Erhalt dieses Schreibens.",
        "anchor": "Erhalt dieses Schreibens",
        "evidence": [
          {
            "page": 1,
            "quote": "Melden Sie abweichende Beschäftigungszeiten innerhalb von zehn Tagen nach Erhalt dieses Schreibens."
          }
        ]
      }
    }
  ]
}
