{
  "schema_version": "1.0",
  "case_id": "AP01-41",
  "purpose": "semantic_ground_truth_never_provider_input",
  "sender": {
    "value": "Fiktive Prüfstelle Musterbezirk 25",
    "evidence": [
      {
        "page": 1,
        "quote": "Fiktive Prüfstelle Musterbezirk 25"
      }
    ]
  },
  "document_date": {
    "value": "2026-10-25",
    "evidence": [
      {
        "page": 1,
        "quote": "Datum: 25.10.2026"
      }
    ]
  },
  "recipients": [
    {
      "name": {
        "value": "Beispielbetrieb Alpha GmbH",
        "evidence": [
          {
            "page": 1,
            "quote": "An: Beispielbetrieb Alpha GmbH"
          }
        ]
      },
      "address": {
        "value": "Musterweg 7, 00000 Beispielstadt",
        "evidence": [
          {
            "page": 1,
            "quote": "Anschrift: Musterweg 7, 00000 Beispielstadt"
          }
        ]
      },
      "identifiers": [
        {
          "type": "other",
          "value": "SYN-0007",
          "jurisdiction": "SYNTHETIC",
          "authority": "Fiktive Beispielstelle",
          "other_type": "synthetic_client_reference",
          "holder_role": "addressee",
          "evidence": [
            {
              "page": 1,
              "quote": "Mandantenreferenz: SYN-0007"
            }
          ]
        }
      ]
    }
  ],
  "customer_candidates": [
    "SYN-CUSTOMER-A"
  ],
  "candidate_evidence": [
    {
      "customer": "SYN-CUSTOMER-A",
      "kind": "exact_identifier",
      "recipient_index": 0,
      "identifier_index": 0
    }
  ],
  "actions": []
}
